Lokasi Posting,Kecamatan/Kab/Kota,Info Tambahan
Binakal,Binakal,"Binakal, East Java · 2.944 orang pernah singgah di sini"
Kabupaten Bondowoso,Bondowoso,Kota
"Curahdami, Jawa Timur, Indonesia",Curahdami,"Curahdami, East Java · 5.038 orang pernah singgah di sini"
"Grujugan, Jawa Timur, Indonesia",Grujugan,Kota
"Klabang, Jawa Timur, Indonesia",Klabang,Kota
"Prajekan, Jawa Timur, Indonesia",Prajekan,Kota
"Pujer, Jawa Timur, Indonesia",Pujer,Kota
"Tegalampel, Jawa Timur, Indonesia",Tegalampel,Kota
"Wringin, Jawa Timur, Indonesia",Wringin,Kota
